{
  "week": "2026-W12",
  "modelVersion": "v1.3.2",
  "featureVersion": "v1.2.0",
  "action": "INFERENCE_ONLY",
  "accuracy": {
    "current_week": 0.75,
    "rolling_4w": 0.73,
    "rolling_12w": 0.71,
    "by_currency": {
      "USD": 0.83,
      "EUR": 0.71,
      "GBP": 0.68,
      "JPY": 0.79,
      "AUD": 0.63,
      "CAD": 0.72,
      "CHF": 0.58,
      "NZD": 0.67
    },
    "by_confidence": {
      "HIGH": 0.84,
      "MEDIUM": 0.69,
      "LOW": 0.51
    }
  },
  "baselines": {
    "random": 0.33,
    "always_bull": 0.41,
    "cot_rule_only": 0.62,
    "vs_cot_rule_delta": 0.09
  }
}
